<?xml version="1.0" encoding="iso-8859-1"?>
<!DOCTYPE REZEPT SYSTEM "../Rezept.dtd">
<?xml-stylesheet type="text/xsl" href="../Rezepte.xsl" ?>
<REZEPT>
  <REZEPTNAME>Russische Sauerkrautsuppe</REZEPTNAME>
  <KATEGORIE>Suppen</KATEGORIE>
  <AUTOR></AUTOR>
  <BEWERTUNG>*****</BEWERTUNG>
 <ANZAHLPERSONEN></ANZAHLPERSONEN>
 <ZUBEREITUNGSZEIT></ZUBEREITUNGSZEIT>
  <ZUTATEN>
    <ZUTAT>750 g Hochrippe vom Rind</ZUTAT>
    <ZUTAT>1 Teel&#246;ffel Salz</ZUTAT>
    <ZUTAT>4 Zwiebeln</ZUTAT>
    <ZUTAT>1 Bund Suppengr&#252;n</ZUTAT>
    <ZUTAT>1 Lorbeerblatt</ZUTAT>
    <ZUTAT>2 Essl&#246;ffel Butter</ZUTAT>
    <ZUTAT>1 Knoblauchzehe</ZUTAT>
    <ZUTAT>1 kg Sauerkraut</ZUTAT>
    <ZUTAT>1 Essl&#246;ffel Paprikapulver, edels&#252;&#223;</ZUTAT>
    <ZUTAT>1 kg Tomaten</ZUTAT>
    <ZUTAT>2 gr&#252;ne Paprikaschoten</ZUTAT>
    <ZUTAT>400 g ger&#228;ucherte W&#252;rstchen</ZUTAT>
    <ZUTAT>&#189; Teel&#246;ffel Zucker</ZUTAT>
    <ZUTAT>je 1 Prise Cayennepfeffer und frisch gemahlener schwarzer Pfeffer</ZUTAT>
    <ZUTAT>150 g saure Sahne</ZUTAT>
    <ZUTAT>4 Essl&#246;ffel gehackte Petersilie</ZUTAT>
  </ZUTATEN>
  <ZUBEREITUNG>
    <ITEM>Das Fleisch waschen und in 2 l Salzwasser zum kochen bringen.</ITEM>
    <ITEM>Die Zwiebeln sch&#228;len. Das Suppengr&#252;n waschen, kleinschneiden, mit 1
    Zwiebel und dem Lorbeerblatt in die Bouillon geben und diese zugedeckt 1 &#189; h kochen
    lassen.</ITEM>
    <ITEM>Die &#252;brigen Zwiebeln w&#252;rfeln.</ITEM>
    <ITEM>Die Butter zerlassen, die Zwiebeln darin anbraten. Den Knoblauch dazudr&#252;cken,
    mit dem Sauerkraut und dem Paprikapulver mischen.</ITEM>
    <ITEM>Die Tomaten h&#228;uten und zerschneiden. Die Paprikaschoten waschen, putzen,
    w&#252;rfeln und mit den Tomaten unter das Kraut mischen.</ITEM>
    <ITEM>Die Bouillon durchseihen, zum Kraut gie&#223;en und alles zugedeckt weitere 25
    Minuten leicht kochen lassen.</ITEM>
    <ITEM>Das Fleisch w&#252;rfeln. Die W&#252;rste in Scheiben schneiden. Beides in die Suppe
    geben.</ITEM>
    <ITEM>Die Suppe mit dem Zucker, dem Cayennepfeffer und dem schwarzen Pfeffer abschmecken.
    Mit der sauren Sahne und der Petersilie servieren.</ITEM>
  </ZUBEREITUNG>
</REZEPT>