<?xml version="1.0" encoding="iso-8859-1"?>
<!DOCTYPE REZEPT SYSTEM "../Rezept.dtd">
<?xml-stylesheet type="text/xsl" href="../../dtd_xsl/Rezepte.xsl" ?>
<REZEPT>
  <REZEPTNAME>Kaukasisches Reiterfleisch</REZEPTNAME>
  <KATEGORIE>Backofen</KATEGORIE>
  <AUTOR></AUTOR>
  <BEWERTUNG></BEWERTUNG>
 <ANZAHLPERSONEN></ANZAHLPERSONEN>
 <ZUBEREITUNGSZEIT></ZUBEREITUNGSZEIT>
  <ZUTATEN>
    <ZUTAT>8 Scheiben Kamm (pro Person rechnet man 2 Scheiben)</ZUTAT>
    <ZUTAT>Salz, Pfeffer, Senf, Zwiebeln</ZUTAT>
    <ZUTAT>1 Glas Letscho</ZUTAT>
    <ZUTAT>Chili-Pulver</ZUTAT>
  </ZUTATEN>
  <ZUBEREITUNG>
    <ITEM>Kammscheiben mit Salz, Pfeffer und Senf w&#252;rzen.</ITEM>
    <ITEM>Die Kammscheiben in einer h&#246;heren Auflaufform hochkant schichten. Zwischen den
    einzelnen Scheiben Zwiebelringe legen.</ITEM>
    <ITEM>Alles mit etwas Chili- Pulver bestreuen und Letscho dar&#252;bergeben.</ITEM>
    <ITEM>Die Form mit Deckel in die R&#246;hre schieben und &#189; Stunde bei Mittelhitze
    garen.</ITEM>
    <ITEM>Vor dem Servieren nochmals &#188; bis &#189; Stunde in der R&#246;hre bei
    Mittelhitze garen.</ITEM>
    <ITEM>Dazu kann &#252;berbackenes Toastbrot gereicht werden. Auch Reis passt dazu.</ITEM>
  </ZUBEREITUNG>
</REZEPT>