<?xml version="1.0" encoding="iso-8859-1"?>
<!DOCTYPE REZEPT SYSTEM "../Rezept.dtd">
<?xml-stylesheet type="text/xsl" href="../Rezepte.xsl" ?>
<REZEPT>
  <REZEPTNAME>Waffeln</REZEPTNAME>
  <KATEGORIE>Backen</KATEGORIE>
  <AUTOR></AUTOR>
  <BEWERTUNG></BEWERTUNG>
  <ANZAHLPERSONEN></ANZAHLPERSONEN>
  <ZUBEREITUNGSZEIT></ZUBEREITUNGSZEIT>
  <ZUTATEN>
    <ZUTAT>125 g Butter</ZUTAT>
    <ZUTAT>25 g Zucker</ZUTAT>
    <ZUTAT>1 P&#228;ckchen Vanillezucker</ZUTAT>
    <ZUTAT>abgeriebene Zitronenschale</ZUTAT>
    <ZUTAT>3 Eier</ZUTAT>
    <ZUTAT>250 g Mehl</ZUTAT>
    <ZUTAT>&#189; P&#228;ckchen Backpulver</ZUTAT>
    <ZUTAT>&#188; Liter Milch oder Sahne</ZUTAT>
  </ZUTATEN>
  <ZUBEREITUNG>
    <ITEM>die Butter schaumig r&#252;hren und Zucker, Vanillezucker, die geriebene
    Zitronenschale und die Eier dazugeben</ITEM>
    <ITEM>danach das mit Backpulver gemischte und gesiebte Mehl mit der Milch
    unterr&#252;hren, bis der Teig Blasen wirft</ITEM>
    <ITEM>als n&#228;chstes das Waffeleisen vorheizen und je nach Art des Waffeleisen
    dieses eventuell ein&#246;len</ITEM>
    <ITEM>beim abbacken nicht zuviel Teig in das Waffeleisen geben</ITEM>
  </ZUBEREITUNG>
</REZEPT>