<?xml version="1.0" encoding="iso-8859-1"?>
<!DOCTYPE REZEPT SYSTEM "../Rezept.dtd">
<?xml-stylesheet type="text/xsl" href="../Rezepte.xsl" ?>
<REZEPT>
  <REZEPTNAME>Sauerkraut</REZEPTNAME>
  <KATEGORIE>Gem&#252;sebeilagen</KATEGORIE>
  <AUTOR>Mei&#223;ner, Christa</AUTOR>
  <BEWERTUNG>*****</BEWERTUNG>
  <ANZAHLPERSONEN>2</ANZAHLPERSONEN>
  <ZUBEREITUNGSZEIT>30 Minuten</ZUBEREITUNGSZEIT>
  <ZUTATEN>
    <ZUTAT>1 Beutel Sauerkraut, ca. 500 g</ZUTAT>
    <ZUTAT>&#189; Teel&#246;ffel Salz</ZUTAT>
    <ZUTAT>3- 4 Teel&#246;ffel Zucker</ZUTAT>
    <ZUTAT>1 Lorbeerblatt</ZUTAT>
    <ZUTAT>1 kleine Zwiebel</ZUTAT>
    <ZUTAT>&#189; Teel&#246;ffel K&#252;mmel</ZUTAT>
    <ZUTAT>1 Messerspitze gemahlenen Pfeffer</ZUTAT>
    <ZUTAT>2 Wacholderbeeren</ZUTAT>
    <ZUTAT>1 Teel&#246;ffel Margarine</ZUTAT>
    <ZUTAT>1 &#189; Tassen Wasser</ZUTAT>
  </ZUTATEN>
  <ZUBEREITUNG>
    <ITEM>alles
    <FETT>20 Minuten</FETT>&#160;bei &#246;fterem Umr&#252;hren kochen</ITEM>
  </ZUBEREITUNG>
</REZEPT>