<?xml version="1.0" encoding="iso-8859-1"?>
<!DOCTYPE REZEPT SYSTEM "../Rezept.dtd">
<?xml-stylesheet type="text/xsl" href="../../dtd_xsl/Rezepte.xsl" ?>
<REZEPT>
 <REZEPTNAME>Grillschnitte</REZEPTNAME>
 <KATEGORIE>Auf dem Grill</KATEGORIE>
 <AUTOR>Anke Herrmann</AUTOR>
 <BEWERTUNG>*****</BEWERTUNG>
 <ANZAHLPERSONEN></ANZAHLPERSONEN>
 <ZUBEREITUNGSZEIT></ZUBEREITUNGSZEIT>
 <ZUTATEN>
  <ZUTAT>Gehacktes, fertig gew&#252;rzt (siehe Boulettenmasse unter Fleischgerichte)</ZUTAT>
  <ZUTAT>Brot</ZUTAT>
 </ZUTATEN>
 <ZUBEREITUNG>
  <ITEM>Auf dem Brot das Gehaktes auftragen und dann auf dem Grill beidseitig grillen.</ITEM>
 </ZUBEREITUNG>
</REZEPT>