<?xml version="1.0" encoding="utf-8" standalone="no"?>
<!DOCTYPE REZEPT SYSTEM "../../dtd_xsl/rezept.dtd">
<?xml-stylesheet type="text/xsl" href="../../dtd_xsl/rezepte.xsl" ?>
<REZEPT>
  <REZEPTNAME>Kürbis- Suppe</REZEPTNAME>
  <KATEGORIE>Suppen</KATEGORIE>
  <AUTOR>Nils Heinold</AUTOR>
  <BEWERTUNG>*****</BEWERTUNG>
 <ANZAHLPERSONEN>8</ANZAHLPERSONEN>
 <ZUBEREITUNGSZEIT></ZUBEREITUNGSZEIT>
  <ZUTATEN>
    <ZUTAT>1 Hokaido- Kürbis, ca 1.000 g unausgenommen</ZUTAT>
    <ZUTAT>2 Esslöffel/ 30 g Butter</ZUTAT>
    <ZUTAT>500 ml Brühe</ZUTAT>
    <ZUTAT>2 Zwiebeln</ZUTAT>
    <ZUTAT>3- 4 cm Ingwer frisch</ZUTAT>
    <ZUTAT>1 Dose Mango, 400 g</ZUTAT>
    <ZUTAT>1 Dose Kokosmilch, 400 g</ZUTAT>
    <ZUTAT>1 Chilischote, rot, oder etwas Chilipulver</ZUTAT>
    <ZUTAT>eventuell Salz</ZUTAT>
  </ZUTATEN>
  <ZUBEREITUNG>
    <ITEM>den Kürbis und die Zwiebeln in Würfel schneiden und in der Butter anschmoren</ITEM>
    <ITEM>danach zusammen mit der Brühe, der Mango, der Kokosmilch und der geschälten und in Streifen geschnittenen Ingwer ca 20 min. köcheln lassen, bis der Kürbis weich zum pürieren ist</ITEM>
    <ITEM>das Ganze jetzt pürieren</ITEM>
    <ITEM>zum Schluss je nach Geschmack mit Chili abschmecken</ITEM>
  </ZUBEREITUNG>
</REZEPT>