<?xml version="1.0" encoding="iso-8859-1"?>
<!DOCTYPE REZEPT SYSTEM "../Rezept.dtd">
<?xml-stylesheet type="text/xsl" href="../../dtd_xsl/Rezepte.xsl" ?>
<REZEPT>
  <REZEPTNAME>Gehaltvolle Soljanka</REZEPTNAME>
  <KATEGORIE>Suppen</KATEGORIE>
  <AUTOR>Mei&#223;ner, Christa</AUTOR>
  <BEWERTUNG>*****</BEWERTUNG>
  <ANZAHLPERSONEN></ANZAHLPERSONEN>
  <ZUBEREITUNGSZEIT>2 Stunden</ZUBEREITUNGSZEIT>
  <ZUTATEN>
    <ZUTAT>750 g Kasslerkamm</ZUTAT>
    <ZUTAT>250 g Dauerwurst, kleingew&#252;rfelt</ZUTAT>
    <ZUTAT>250 g Jagdwurst, kleingew&#252;rfelt</ZUTAT>
    <ZUTAT>1 Glas Letscho ( 720 ml)</ZUTAT>
    <ZUTAT>1 B&#252;chse passierte Tomaten ( 400 g)</ZUTAT>
    <ZUTAT>1 Glas roter Paprika mit Fl&#252;ssigkeit, kleingeschnitten ( 720 ml)</ZUTAT>
    <ZUTAT>5 feingeschnittene Gew&#252;rzgurken</ZUTAT>
    <ZUTAT>2 mittlere Zwiebeln, kleingew&#252;rfelt</ZUTAT>
    <ZUTAT>1 Lorbeerblatt</ZUTAT>
    <ZUTAT>2 Chilischoten, klein, getrocknet</ZUTAT>
    <ZUTAT>3 Pimentk&#246;rner</ZUTAT>
    <ZUTAT>10 Pfefferk&#246;rner</ZUTAT>
    <ZUTAT>3 Knoblauchzehen</ZUTAT>
    <ZUTAT>&#189; Liter Tomatensaft</ZUTAT>
    <ZUTAT>Tomatenketchup - ungew&#252;rzt ! ( 300- 400 g)</ZUTAT>
    <ZUTAT>2 Essl&#246;ffel dunklen Balsamico- Essig</ZUTAT>
    <ZUTAT>Salz, Chilipulver und Zucker zum Abschmecken</ZUTAT>
    <ZUTAT>Margarine zum Anbraten</ZUTAT>
  </ZUTATEN>
  <ZUBEREITUNG>
    <ITEM>Kassler in 4 Tassen Wasser, eine der Zwiebeln, Lorbeerblatt, Chilischoten,
    Piment, Pfeffer, Knoblauch ansetzen und 1 &#189; Stunden kochen lassen. Die
    Dauerwurst die letzte halbe Stunde zugeben, Fleisch dann klein schneiden.</ITEM>
    <ITEM>Nach der Garzeit das Letscho, den Paprika, die Gurken, den Tomatensaft, die
    passierten Tomaten, Ketchup und den Balsamico unterr&#252;hren.</ITEM>
    <ITEM>Die Jagdwurstw&#252;rfel mit der anderen Zwiebel anbraten, alles dazugeben. Zum
    Schluss eventuell den gesamten Ansatz mit Wasser bis auf suppige Konsistenz
    verd&#252;nnen, mit
    <FETT>Zucker</FETT>, Salz und Chilipulver abschmecken</ITEM>
  </ZUBEREITUNG>
</REZEPT>