<?xml version="1.0" encoding="utf-8" standalone="no"?>
<!DOCTYPE REZEPT SYSTEM "../../dtd_xsl/rezept.dtd">
<?xml-stylesheet type="text/xsl" href="../../dtd_xsl/rezepte.xsl" ?>
<REZEPT>
  <REZEPTNAME>Kartofflesuppe mit Aal</REZEPTNAME>
  <KATEGORIE>Suppen</KATEGORIE>
  <AUTOR></AUTOR>
  <BEWERTUNG></BEWERTUNG>
 <ANZAHLPERSONEN></ANZAHLPERSONEN>
 <ZUBEREITUNGSZEIT></ZUBEREITUNGSZEIT>
  <ZUTATEN>
    <ZUTAT>500 g Kartoffeln</ZUTAT>
    <ZUTAT>200 g Porree</ZUTAT>
    <ZUTAT>2- 3 TL Meerrettich naturell</ZUTAT>
    <ZUTAT>1 Becher Schlagsahne</ZUTAT>
    <ZUTAT>1 St&#252;ck R&#228;ucheraal</ZUTAT>
    <ZUTAT>Zitronensaft</ZUTAT>
    <ZUTAT>Salz und Pfeffer</ZUTAT>
  </ZUTATEN>
  <ZUBEREITUNG>
    <ITEM>Porree in Ringe schneiden und kurz and&#252;nsten</ITEM>
    <ITEM>Kartoffeln sch&#228;len und in St&#252;cke schneiden und in ca. 1 L Br&#252;he mit
    dem Porree gar kochen. Anschlie&#223;end alles mit dem Mixstab p&#252;rieren.</ITEM>
    <ITEM>Meerrettich unterr&#252;hren.</ITEM>
    <ITEM>R&#228;ucheraal enth&#228;uten und entgr&#228;ten und in St&#252;cke schneiden und
    ebenfalls unter die Suppe r&#252;hren.</ITEM>
    <ITEM>Die Schlagsahne unterheben und alles mit Salz, Pfeffer und Zitronensaft
    abschmecken.</ITEM>
  </ZUBEREITUNG>
</REZEPT>